id,text,username,timestamp,permalink,media_type,media_url,reply_length,has_text,is_nested,manual_sentiment,is_tagged
17852474634512912,"A jar of peanutbutter has way more calories than a coke liter, which is healthier? Same price give or take",_anthony_dempsey_,2025-08-10 14:04:53+00:00,https://www.threads.com/@_anthony_dempsey_/post/DNLVysfuZBm,TEXT_POST,,106.0,TRUE,FALSE,neutral,yes
17946001551031391,Retard opinion,_demonwizard_,2025-08-10 21:01:04+00:00,https://www.threads.com/@_demonwizard_/post/DNMFa4ZR9do,TEXT_POST,,14.0,TRUE,FALSE,negative,yes
18395551171189205,"The thing is you can just drink more water. It's already paid for with your bills and it comes in bigger bottles than soda. That's it, that's all you have to do to get the same effect, just drink more of it. Your body will be happier for it too.",_devils.advocate._,2025-08-09 21:25:56+00:00,https://www.threads.com/@_devils.advocate._/post/DNJjeIYS3Zi,TEXT_POST,,245.0,TRUE,FALSE,neutral,yes
18290511739302136,"Coke unclogs feeding tubes. Sprite is a clear liquid for those ill or unable to eat solids. 
🤷‍♀️",_firegoddess,2025-08-10 16:37:35+00:00,https://www.threads.com/@_firegoddess/post/DNLnRIqp8-5,TEXT_POST,,97.0,TRUE,FALSE,positive,yes
17985957308842185,No one needs soda. It has no nutritional benefit.,_jen_jensen_,2025-08-10 13:11:11+00:00,https://www.threads.com/@_jen_jensen_/post/DNLPpVtNjiw,TEXT_POST,,49.0,TRUE,FALSE,negative,yes
17909410959195780,You can get some noodles for like $1,_knack4daball,2025-08-10 16:55:13+00:00,https://www.threads.com/@_knack4daball/post/DNLpSPEJFCh,TEXT_POST,,36.0,TRUE,FALSE,neutral,yes
18516671779030608,What in the fat fuck did I just read?!?!??!???,_masons_collectibles,2025-08-10 19:28:12+00:00,https://www.threads.com/@_masons_collectibles/post/DNL6ys2SCRp,TEXT_POST,,46.0,TRUE,FALSE,negative,yes
18076279702961661,Buy a bag of oranges,_missfit_13_,2025-08-11 20:56:23+00:00,https://www.threads.com/@_missfit_13_/post/DNOprhFS6Ec,TEXT_POST,,20.0,TRUE,FALSE,neutral,yes
18080014261931414,You’ve got to be kidding,_timgrady,2025-08-10 12:53:42+00:00,https://www.threads.com/@_timgrady/post/DNLNpSguxBY,TEXT_POST,,24.0,TRUE,FALSE,negative,yes
17844761910547018,Or you can get a load of bread and some bologna or peanut butter instead of a soda.,_under_wicked_sky,2025-08-10 01:19:26+00:00,https://www.threads.com/@_under_wicked_sky/post/DNJ-MXRMTUr,TEXT_POST,,83.0,TRUE,FALSE,neutral,yes
17916725130140290,Drink tap water buy banana,2000boostedintegra,2025-08-09 22:47:26+00:00,https://www.threads.com/@2000boostedintegra/post/DNJszG0y4Kk,TEXT_POST,,26.0,TRUE,FALSE,neutral,yes
17872900746404887,So let these people have their sugar if they want it. Just have them sign a wavier  relinquishing their government health benefits.  You can’t use our money on poor food choices then expect us to pay your medical bills for the conditions your poor choices cause.,549pr11,2025-08-10 18:29:28+00:00,https://www.threads.com/@549pr11/post/DNL0Ei0OXpH,TEXT_POST,,262.0,TRUE,FALSE,negative,yes
18086721091699789,Butter or peanut butter will work too and are cheaper and healthier,8bit_geek,2025-08-10 00:09:44+00:00,https://www.threads.com/@8bit_geek/post/DNJ2NyxOcfd,TEXT_POST,,67.0,TRUE,FALSE,neutral,yes
18074698139088604,It’s not just unpopular it’s incorrect,8point5_,2025-08-11 14:34:50+00:00,https://www.threads.com/@8point5_/post/DNN-A5LRmz_,TEXT_POST,,38.0,TRUE,FALSE,negative,yes
17862445431448677,Sounds like you just listed some bs excuses and it checks out lol,8point5_,2025-08-11 14:35:35+00:00,https://www.threads.com/@8point5_/post/DNN-GYbRZZc,65,TRUE,,,,negative,yes
17869199895423290,Beans or rice would be better. Diabetes kills!,a.blnknshp,2025-08-09 21:14:15+00:00,https://www.threads.com/@a.blnknshp/post/DNJiIiHSE2z,TEXT_POST,,46.0,TRUE,FALSE,negative,yes
18090165847739693,"im thirsty now, im going to drink some fruit punch :D",a10rawmilkenjoyer,2025-08-10 04:27:56+00:00,https://www.threads.com/@a10rawmilkenjoyer/post/DNKTw6wOidB,TEXT_POST,,53.0,TRUE,FALSE,neutral,yes
18059492378077594,Make better choices.,aaronhohlt,2025-08-10 17:05:42+00:00,https://www.threads.com/@aaronhohlt/post/DNLqfCFNJyu,TEXT_POST,,20.0,TRUE,FALSE,negative,yes
18333992812207626,I care more about my tax dollars going towards bombs being dropped on kids halfway across the world and going into the pockets of the military industrial complex.  I'd rather someone get fed than pay for another bomb to get dropped on civilians. better to help the people in need than the war criminals who have everything,abigail_saoirse_finnegan,2025-08-10 17:33:32+00:00,https://www.threads.com/@abigail_saoirse_finnegan/post/DNLtq7DoauA,TEXT_POST,,322.0,TRUE,FALSE,positive,yes
18052967072431131,You're obese ma'am. You're a burden to the food stamp and medical system. Respectfully,acceptannce,2025-08-10 15:31:34+00:00,https://www.threads.com/@acceptannce/post/DNLftgvNGx7,TEXT_POST,,86.0,TRUE,FALSE,negative,yes
18074327471060018,Wait until you won’t be able to buy pop with your SNAP benefits… It’s a new thing coming next year so good luck to ya 😂,acrane82,2025-08-10 03:08:56+00:00,https://www.threads.com/@acrane82/post/DNKKuWhsanI,TEXT_POST,,119.0,TRUE,FALSE,negative,yes
18090613804734001,Bun length ball park hot dogs are $2.97.,adamc_rk,2025-08-10 21:05:16+00:00,https://www.threads.com/@adamc_rk/post/DNMF5sHyVc0,40,TRUE,,,,negative,yes
18280397170279536,Never in my life have I been hungry and thought oh a soda will take care of my hunger,adamtyler182,2025-08-11 04:05:56+00:00,https://www.threads.com/@adamtyler182/post/DNM2CrbRQpR,TEXT_POST,,85.0,TRUE,FALSE,negative,yes
18416397850101304,"I’ve been to the point where I’ve had to buy a box of pancake mix and make it last a week, for EVERY meal. Not because I love pancakes, but because it was the cheapest and most filling thing I could think of that would make more than one meal. 
Sometimes it’s not about the healthiest or tastiest option. Sometimes it’s about finding what will sustain you the longest. 
Too many people don’t even TRY to understand situations they’ve never been put in.",adriannaaa_roseee,2025-08-10 00:21:43+00:00,https://www.threads.com/@adriannaaa_roseee/post/DNJ3lqIhf5i,TEXT_POST,,452.0,TRUE,FALSE,positive,yes
17882248521242616,You're definitely no nutritional authority,adventuremington,2025-08-10 17:08:47+00:00,https://www.threads.com/@adventuremington/post/DNLq1lmOZIl,TEXT_POST,,42.0,TRUE,FALSE,negative,yes
17855893353484431,"I will drink a coke to fill me up when I’m too busy to take a lunch break, or didn’t bring lunch from home and can’t spend the money on takeout. It’s just about getting through the day sometimes.",aedwards37,2025-08-10 10:45:33+00:00,https://www.threads.com/@aedwards37/post/DNK--vlO0rq,TEXT_POST,,195.0,TRUE,FALSE,positive,yes
18016212770762009,Beggers can't be choosers. Be grateful for the money the government took from someone else and gave to you.,afreeman_livingthedream,2025-08-09 22:22:07+00:00,https://www.threads.com/@afreeman_livingthedream/post/DNJp5ltyj1l,TEXT_POST,,107.0,TRUE,FALSE,negative,yes
18525729460056360,Maybe show a little gratitude over entitlement and you'll get a very different reply from people.,afreeman_livingthedream,2025-08-09 22:34:46+00:00,https://www.threads.com/@afreeman_livingthedream/post/DNJrWUjty3W,97,TRUE,,,,negative,yes
18525729460056360,Maybe show a little gratitude over entitlement and you'll get a very different reply from people.,afreeman_livingthedream,2025-08-09 22:34:46+00:00,https://www.threads.com/@afreeman_livingthedream/post/DNJrWUjty3W,97,TRUE,,,,negative,yes
17908790040084703,"Girl! I hear you! Sometimes I just don’t feel like eating 🥣 anything (I’m not poor, just picky) and I drink a soda 🥤 and life is better! Especially when I’m at work, (I’m a nurse👩🏼‍⚕️)",ahuffangel,2025-08-10 07:52:09+00:00,https://www.threads.com/@ahuffangel/post/DNKrIpEOa4a,TEXT_POST,,184.0,TRUE,FALSE,positive,yes
18107281396530322,You could buy a bag of apples for 3 dollars,ahwrx,2025-08-11 06:55:36+00:00,https://www.threads.com/@ahwrx/post/DNNJdZuukfE,TEXT_POST,,43.0,TRUE,FALSE,neutral,yes
18320872864227522,"Yeah when I had my first job, I had enough money for vending machine lunches
 So it was a bag of potato chips and a can of mountain do. Wasn't the healthiest, but it was better than chips and water, or even two bags of chips.",aicaicem,2025-08-10 17:35:48+00:00,https://www.threads.com/@aicaicem/post/DNLt7cTx7VZ,TEXT_POST,,225.0,TRUE,FALSE,positive,yes
18164387911325049,"Yeah when I had my first job, I had enough money for vending machine lunches
 So it was a bag of potato chips and a can of mountain do. Wasn't the healthiest, but it was better than chips and water, or even two bags of chips.",aicaicem,2025-08-10 17:35:35+00:00,https://www.threads.com/@aicaicem/post/DNLt56BxlxP,TEXT_POST,,225.0,TRUE,FALSE,positive,yes
17941920054018964,"also people with t1 diabetes need access to sugary drinks! it helps them get their blood sugar up much faster than food, so if they're dropping quickly it's much better to have a soda on hand",alaina_k_burr,2025-08-10 19:47:56+00:00,https://www.threads.com/@alaina_k_burr/post/DNL9DMkBozS,TEXT_POST,,191.0,TRUE,FALSE,positive,yes
18074571070989784,1 banana and 1 Apple would be a better option.,alemorales_123,2025-08-10 18:56:19+00:00,https://www.threads.com/@alemorales_123/post/DNL3JQIvfM8,TEXT_POST,,46.0,TRUE,FALSE,negative,yes
18124832446462834,You know what's even better than a $3 jug of soda. 3-6 cans of beans for $3 which could feed you for a couple days. Has protein and fiber to stave off hunger and actual nutrition.,alex.w.burton,2025-08-10 01:04:16+00:00,https://www.threads.com/@alex.w.burton/post/DNJ8dRwM7va,TEXT_POST,,179.0,TRUE,FALSE,negative,yes
17948938712880719,"SNAP sounds for Supplemental Nutrition Assistance Program. Soda, while enjoyable to drink, is made up of empty calories and is largely bereft of nutritional value. If the taxpayer is forced to pay for your “nutrition” it should be nutritious, not a sugary treat.",alexbitzan,2025-08-10 20:41:42+00:00,https://www.threads.com/@alexbitzan/post/DNMDNEYJJI-,TEXT_POST,,262.0,TRUE,FALSE,negative,yes
17887706862204892,Spoken like a true big back,alexd_1231,2025-08-11 15:28:23+00:00,https://www.threads.com/@alexd_1231/post/DNOEJErR-rM,TEXT_POST,,27.0,TRUE,FALSE,negative,yes
18079100842901113,Who gives af what’s satiating to someone or not,alexisokayaf,2025-08-10 07:21:46+00:00,https://www.threads.com/@alexisokayaf/post/DNKnqIktOMv,TEXT_POST,,47.0,TRUE,FALSE,negative,yes
17883071709356957,Well in that case get sugar and water. Still comes up less expensive than soda 🤷🏻‍♀️,aliceblin,2025-08-10 01:46:50+00:00,https://www.threads.com/@aliceblin/post/DNKBVF8RtFn,TEXT_POST,,84.0,TRUE,FALSE,negative,yes
18075249640824392,Been through all 3. Have low sugar issues and I still agree with my tax paying dollars to fund something healthier. An apple is around 1$ and would work best than sugar. It’s a simple/complex carb thing. Look it up if you worry about these things you say you do!,aliceblin,2025-08-10 01:48:03+00:00,https://www.threads.com/@aliceblin/post/DNKBd-YxDxk,262,TRUE,,,,negative,yes
18159828703335582,Snap seem to be feeding you well babe.,aliciasmiff,2025-08-10 08:49:53+00:00,https://www.threads.com/@aliciasmiff/post/DNKxvk9u__k,TEXT_POST,,38.0,TRUE,FALSE,negative,yes
18372731287181265,"There’s plenty of other beverages you can drink. Sugar in most available soda pop is high fructose corn syrup, very far from regular sugar",allik4tt,2025-08-10 00:59:29+00:00,https://www.threads.com/@allik4tt/post/DNJ76LpAimp,TEXT_POST,,138.0,TRUE,FALSE,negative,yes
18015338225769096,"You’re right, it is unpopular.",almanaylor1,2025-08-10 14:41:02+00:00,https://www.threads.com/@almanaylor1/post/DNLZ7gAu65z,TEXT_POST,,30.0,TRUE,FALSE,negative,yes
18114759985512086,You need to lay off the sugar not than a little hun.,alock_23,2025-08-10 06:37:44+00:00,https://www.threads.com/@alock_23/post/DNKinnsN-Qm,TEXT_POST,,52.0,TRUE,FALSE,negative,yes
18231247015294607,"Actual soda would be one of the worst things to buy if you are hungry and only have 3$. There are plenty of cheap alternatives that offer some nutrients, are shelf stable and filling like a jar of peanut butter. Soda  doesn't have any protein, fiber or fat, which makes you feel full and stay full, but also the high sugar and caffeine can cause dehydration.",amanda_belleglass,2025-08-11 04:45:46+00:00,https://www.threads.com/@amanda_belleglass/post/DNM6mZqOltJ,TEXT_POST,,358.0,TRUE,FALSE,negative,yes
18087441070761322,Something that also has sugar (naturally from the fruit) and is liquid? Orange juice. And it will still be covered. But so many better more filling things can be purchased for $3,amandagracephoto.co,2025-08-10 04:17:07+00:00,https://www.threads.com/@amandagracephoto.co/post/DNKShzBto4P,TEXT_POST,,178.0,TRUE,FALSE,negative,yes
18102296536506523,Oink,americainteresting2,2025-08-10 23:46:21+00:00,https://www.threads.com/@americainteresting2/post/DNMYVfypBhL,TEXT_POST,,4.0,TRUE,FALSE,negative,yes
17934003837074108,I don’t suppose you’ve heard of a salad,americainteresting2,2025-08-10 23:46:35+00:00,https://www.threads.com/@americainteresting2/post/DNMYXLUJoLF,39,TRUE,,,,negative,yes
18069347930117599,This is the stupidest thing I have read all day,andrew_aldridge,2025-08-10 10:48:54+00:00,https://www.threads.com/@andrew_aldridge/post/DNK_XNQutZS,TEXT_POST,,47.0,TRUE,FALSE,negative,yes
17980673282909512,I've been both. And I say that SNAP cutting off sugary food is awesome,angelic_syns,2025-08-10 02:52:24+00:00,https://www.threads.com/@angelic_syns/post/DNKI1OdsNTf,70,TRUE,,,,negative,yes
17980673282909512,I've been both. And I say that SNAP cutting off sugary food is awesome,angelic_syns,2025-08-10 02:52:24+00:00,https://www.threads.com/@angelic_syns/post/DNKI1OdsNTf,70,TRUE,,,,negative,yes
18147369376396714,I don’t think soda is ever a good option regardless unless you’re drinking it with whiskey,angelnoel_96_19_20_21_23,2025-08-10 18:55:48+00:00,https://www.threads.com/@angelnoel_96_19_20_21_23/post/DNL3FbAJmOc,TEXT_POST,,90.0,TRUE,FALSE,negative,yes
17983617746711753,Orrrrr 3 apples,annadparker,2025-08-10 11:46:37+00:00,https://www.threads.com/@annadparker/post/DNLF97gAT8h,TEXT_POST,,15.0,TRUE,FALSE,negative,yes
18091802401661137,Make spaghetti,apicasso74,2025-08-10 22:23:53+00:00,https://www.threads.com/@apicasso74/post/DNMO5ZXRnqp,TEXT_POST,,14.0,TRUE,FALSE,negative,yes
18303787999217826,There was a point in time where my family could only eat what we went out and killed ourselves or what food stamps provided. Soda was a luxury because actually nutritious meals were gonna get us by for longer than the short term sugar high.,archelunatic,2025-08-10 08:34:50+00:00,https://www.threads.com/@archelunatic/post/DNKwBWZOLHs,TEXT_POST,,240.0,TRUE,FALSE,negative,yes
17850899199530549,"Nice bait, sow",arfanclubofficial,2025-08-11 03:08:51+00:00,https://www.threads.com/@arfanclubofficial/post/DNMvgjuMFtm,TEXT_POST,,14.0,TRUE,FALSE,negative,yes
18078432833308637,Sugar is the fastest digesting source of calories its not sustaining nobody’s hunger and people can go a month without food u dont need a daily sugar injection with no nutrients.,artur.makaryan0,2025-08-10 05:51:12+00:00,https://www.threads.com/@artur.makaryan0/post/DNKdS1nNC3N,178,TRUE,,,,negative,yes
18009578453608776,"You know what else staves off hunger?? The gym. Or in the absence of a gym, 7 or 8 laps 6 times a week around a local school track.",asmithberg1977,2025-08-09 23:14:10+00:00,https://www.threads.com/@asmithberg1977/post/DNJv22CtFfj,TEXT_POST,,131.0,TRUE,FALSE,negative,yes
18043814708641699,Rice is cheaper than soda you fat fuck,atouchofturquoise,2025-08-09 22:13:14+00:00,https://www.threads.com/@atouchofturquoise/post/DNJo4mSuAMR,TEXT_POST,,38.0,TRUE,FALSE,negative,yes
17909194590195262,yeah I know a bunch of homeless people who have to basically eat garbage because they don't have access to a kitchen,audreylbowers,2025-08-09 22:54:09+00:00,https://www.threads.com/@audreylbowers/post/DNJtkRAPG_J,116,TRUE,,,,positive,yes
18396661276143785,"I personally could come up with a lot better options for $3. 
But I don’t think it’s anyone else’s decision to make other than the person buying it so there’s also that.",auriellamonroe,2025-08-10 03:02:51+00:00,https://www.threads.com/@auriellamonroe/post/DNKKB0TRHdq,TEXT_POST,,169.0,TRUE,FALSE,positive,yes
18081007690923375,$3 can buy you 12 bannanas.  That’s a healthy choice.  There’s absolutely no reason that someone should be drinking soda because they’re hungry.  Are you that stupid or are you sponsored by big sugar?,awirecki,2025-08-10 21:59:05+00:00,https://www.threads.com/@awirecki/post/DNMMDyVxTuC,TEXT_POST,,200.0,TRUE,FALSE,negative,yes
17962990451797318,😂😂😂😂😂😂😂😂😂😂😂😂😂😂😂😂😂😂😂😂😂😂😂😂😂😂😂😂😂😂😂😂😂😂😂😂😂😂😂😂😂😂😂😂😂😂😂😂😂😂😂😂😂😂😂😂😂😂😂😂😂😂😂😂😂😂😂😂😂😂😂😂😂😂😂😂😂😂😂😂😂😂😂😂😂😂😂😂😂😂😂,ayo.esteelo,2025-08-10 05:00:03+00:00,https://www.threads.com/@ayo.esteelo/post/DNKXcJtu-pt,TEXT_POST,,91.0,TRUE,FALSE,negative,yes
17971890896925021,Been homeless and on EBT. You DO NOT need the soda.,ayo.esteelo,2025-08-10 05:00:21+00:00,https://www.threads.com/@ayo.esteelo/post/DNKXeWXuOTa,51,TRUE,,,,negative,yes
18125224867464350,"As a diabetic I know all about hypoglycemia and its onset from crashing from high sugar components in your diet. Sugar staves off hypoglycemia temporarily, but high sugar intake can often be the cause. Healthier choices have a mix of carbs and protein to last longer",badzodiac,2025-08-11 01:51:08+00:00,https://www.threads.com/@badzodiac/post/DNMmnatO9hN,TEXT_POST,,266.0,TRUE,FALSE,neutral,yes
18055378019413790,Yeah I didn't even have to look at your profile and I already knew this was a morbidly obese take,banksmuscle_,2025-08-10 17:25:17+00:00,https://www.threads.com/@banksmuscle_/post/DNLsueKxpTF,TEXT_POST,,97.0,TRUE,FALSE,negative,yes
18052443677618112,People on snap are grown adults. Pretty sure they can make decisions on their own. No one needs the govt dictating what we eat or drink.,beach_writer17,2025-08-10 16:13:43+00:00,https://www.threads.com/@beach_writer17/post/DNLkiQtOYsy,TEXT_POST,,136.0,TRUE,FALSE,positive,yes
17850610272527277,"I mean, yeah, that’s true. All of what you said is true. Pretty sure all your opposition is coming from people who think you’re advocating for homeless people with three bucks left on EBT to chug an entire two-liter in one go.",bendrivesanambo,2025-08-09 22:26:34+00:00,https://www.threads.com/@bendrivesanambo/post/DNJqaLlyAUL,TEXT_POST,,226.0,TRUE,FALSE,positive,yes
18069983669115171,I’ve seen poor people in the inner-city neighborhoods survive off of chips and sodas for days. ,bensnugs,2025-08-09 22:16:37+00:00,https://www.threads.com/@bensnugs/post/DNJpRTmSoUm,TEXT_POST,,97.0,TRUE,FALSE,positive,yes
18398002336191571,You are like Hitler lecturing us about Jewish healthcare.,bergy350,2025-08-10 09:35:51+00:00,https://www.threads.com/@bergy350/post/DNK3APvNSc5,TEXT_POST,,57.0,TRUE,FALSE,negative,yes
17912289756057130,"Guys, most healthcare professionals and doctors would disagree. Obviously if you have hypoglycemia that is different but that is pretty flase. The sugar in soda does more harm than good, its literally an addictive substance which is why you crave more when consumed. Just look at the OPs profile, I dont think we should be takong health advice from OP.",bgarcia_3,2025-08-10 11:21:27+00:00,https://www.threads.com/@bgarcia_3/post/DNLDFmlRnTc,TEXT_POST,,352.0,TRUE,FALSE,negative,yes
18524897515052271,That may be one of the dumbest things to have been posted on this platform at this point.,big_redd101416,2025-08-10 22:27:48+00:00,https://www.threads.com/@big_redd101416/post/DNMPWI3teXu,TEXT_POST,,89.0,TRUE,FALSE,negative,yes
17962821371797268,This is ignorance,bigstogs,2025-08-10 11:36:32+00:00,https://www.threads.com/@bigstogs/post/DNLE0KfOI0Y,TEXT_POST,,17.0,TRUE,FALSE,negative,yes
17866679754430690,daily reminder to never take eating advice from anyone who look like you,bill_182_23,2025-08-10 15:40:38+00:00,https://www.threads.com/@bill_182_23/post/DNLgv_CtA7g,TEXT_POST,,72.0,TRUE,FALSE,negative,yes
18093161734633392,You could just mix sugar and water at home and spend the 3 dollars on 3 cans of beans for protien and carbs.,billpelowitz,2025-08-10 00:53:42+00:00,https://www.threads.com/@billpelowitz/post/DNJ7P3steYw,TEXT_POST,,108.0,TRUE,FALSE,negative,yes
18087831856802690,Have you ever heard of eating less and moving your body more ?,billpelowitz,2025-08-10 10:32:19+00:00,https://www.threads.com/@billpelowitz/post/DNK9dz0uY6q,62,TRUE,,,,negative,yes
18073096730292859,Soda dehydrates your body,bingbongaronis,2025-08-10 05:08:10+00:00,https://www.threads.com/@bingbongaronis/post/DNKYXl8tl92,TEXT_POST,,25.0,TRUE,FALSE,negative,yes
17889064251328271,You can stand to be a bit hungrier,bk_chronister,2025-08-10 13:45:48+00:00,https://www.threads.com/@bk_chronister/post/DNLTm6PxrxB,TEXT_POST,,34.0,TRUE,FALSE,negative,yes
18045005408317534,Go hungry longer. Run things in a calorie deficit,blackblazee,2025-08-09 21:11:39+00:00,https://www.threads.com/@blackblazee/post/DNJh1liS025,TEXT_POST,,49.0,TRUE,FALSE,negative,yes
18517805506046196,So you're a homeless engineer who os studying to be an AI Engineer.,blanepakulski,2025-08-10 00:46:26+00:00,https://www.threads.com/@blanepakulski/post/DNJ6aoXRmm3,67,TRUE,,,,negative,yes
18088313830782665,Soda is not a good alternative to ARFID or Hyperglycemia. Hyperglycemia is also caused by insufficient food intake. Substituting meals for soda falls into that “insufficient” category,blucru415,2025-08-09 22:18:38+00:00,https://www.threads.com/@blucru415/post/DNJpgLwhb86,183,TRUE,,,,negative,yes
18373855177176365,Are you this person? Your bio says you are a software engineer. How about don’t post on things you don’t understand,blucru415,2025-08-09 22:19:46+00:00,https://www.threads.com/@blucru415/post/DNJpoawhnjv,115,TRUE,,,,negative,yes
17896894839260522,"I promise you, you’re not missing out on any meals. If you’re on government assistance you shouldn’t be buying soda period. There’s families that work 40 plus hours a week and are putting things back.",blueeyed_conservative,2025-08-11 00:13:23+00:00,https://www.threads.com/@blueeyed_conservative/post/DNMbbcaOUGU,TEXT_POST,,200.0,TRUE,FALSE,negative,yes
17888378568324902,Cope harder,bluntista,2025-08-10 16:32:20+00:00,https://www.threads.com/@bluntista/post/DNLmqrhRv_B,TEXT_POST,,11.0,TRUE,FALSE,negative,yes
17919838380120486,"“Liquid”. Lady, that’s water.  The sugar is giving you diabetes.",bmedlin07,2025-08-09 23:08:54+00:00,https://www.threads.com/@bmedlin07/post/DNJvQRQxRx-,TEXT_POST,,64.0,TRUE,FALSE,negative,yes
18073272521081107,"You don't need anymore sugar. Your face looks like it's been stung by a bunch of bees, and get a better job",boba_fitt83,2025-08-10 21:51:55+00:00,https://www.threads.com/@boba_fitt83/post/DNMLPVDyXYp,TEXT_POST,,107.0,TRUE,FALSE,negative,yes
18261712195303119,"Stooooooop the cap 😂 try lemon water, that actually suppresses appetite plus it wouldn’t hurt for some people to fast.",boldbeardsmen,2025-08-09 22:12:59+00:00,https://www.threads.com/@boldbeardsmen/post/DNJo2vO04t3,TEXT_POST,,118.0,TRUE,FALSE,negative,yes
18077408989760376,"There are MANY things in the grocery store you can eat vs a $3 soda for health reasons or homelessness. Give me a fucking break! Excuses. You do not NEED soda! It is GARBAGE!!!! 

The sugar in soda in the US is HFCS and that shit is garbage. It is trash. It’s not real sugar. If you ask me it’s why so many people are obese and have diabetes. It’s the FOOD and what’s in it! Chemicals! Keep crying over your soda and junk food. This country as a whole needs to eat better.",borednow_77,2025-08-10 13:08:08+00:00,https://www.threads.com/@borednow_77/post/DNLPTCdNp2P,TEXT_POST,,472.0,TRUE,FALSE,negative,yes
17931433202960677,I think you need a nutritionist and some exercise before you go and give any advice on being healthy.,boston2116102020,2025-08-10 18:32:15+00:00,https://www.threads.com/@boston2116102020/post/DNL0Y3whfl3,TEXT_POST,,101.0,TRUE,FALSE,negative,yes
18145248475368623,Dumbest post ever,boyerpartyof3,2025-08-10 18:03:10+00:00,https://www.threads.com/@boyerpartyof3/post/DNLxD7vRabB,TEXT_POST,,17.0,TRUE,FALSE,negative,yes
17878156341386051,But you’re wrong,boyerpartyof3,2025-08-10 18:03:26+00:00,https://www.threads.com/@boyerpartyof3/post/DNLxF0zRdAf,16,TRUE,,,,negative,yes
17865416562433445,You’re fucking insane,boyerpartyof3,2025-08-10 18:05:04+00:00,https://www.threads.com/@boyerpartyof3/post/DNLxR4JR5u8,21,TRUE,,,,negative,yes
17878156341386051,But you’re wrong,boyerpartyof3,2025-08-10 18:03:26+00:00,https://www.threads.com/@boyerpartyof3/post/DNLxF0zRdAf,16,TRUE,,,,negative,yes
18051019262549484,The solution is that you shouldn’t be able to get soda and candy with food stamps. And you shouldn’t be able to,boyerpartyof3,2025-08-10 18:04:09+00:00,https://www.threads.com/@boyerpartyof3/post/DNLxLEORDp0,111,TRUE,,,,negative,yes
18071158370035856,You can afford a $3 soda but not 3 $1 ramen noodle packs?,brayden_domanick,2025-08-10 10:47:22+00:00,https://www.threads.com/@brayden_domanick/post/DNK_L-euFXm,TEXT_POST,,57.0,TRUE,FALSE,negative,yes
18307274158300943,"Buy the soda with your paycheck. Don’t like it? Buy a V8, an apple juice. Lots of other sugar balancing choices. Get a grip",braylinsmom,2025-08-10 19:19:45+00:00,https://www.threads.com/@braylinsmom/post/DNL503rS7Zg,TEXT_POST,,123.0,TRUE,FALSE,negative,yes
